{
  "$schema": "https://json-schema.org/draft/2020-12/schema",
  "$id": "urn:klib-forge:spec:0.1:eval",
  "title": "K-LIB Evaluation",
  "type": "object",
  "required": ["id", "input", "checks"],
  "properties": {
    "id": {
      "type": "string",
      "pattern": "^[A-Za-z0-9][A-Za-z0-9._-]{0,127}$"
    },
    "name": { "type": "string" },
    "task": { "type": "string" },
    "input": { "type": "string", "minLength": 1 },
    "checks": {
      "type": "object",
      "properties": {
        "must_include": { "type": "array", "items": { "type": "string" } },
        "must_include_any": {
          "type": "array",
          "items": {
            "oneOf": [
              { "type": "string" },
              { "type": "array", "items": { "type": "string" }, "minItems": 1 }
            ]
          }
        },
        "must_not_include": { "type": "array", "items": { "type": "string" } },
        "json_valid": { "type": "boolean" },
        "citation_required": { "type": "boolean" }
      },
      "additionalProperties": false
    }
  },
  "additionalProperties": true
}
