{
  "id": "bio-mendel-013",
  "name": "Monohybrid phenotypic ratio and law",
  "task": "grounded_biology",
  "input": "In a monohybrid cross between two heterozygotes, what phenotypic ratio is expected, and which Mendelian law explains allele separation? Cite.",
  "checks": {
    "must_include_any": [
      [
        "3:1",
        "3 to 1",
        "3 : 1"
      ],
      [
        "segregation"
      ]
    ],
    "citation_required": true
  }
}
